{"schemaVersion":"1.0.0","artifactType":"policy-process-design","proposalOnly":true,"sourceDigests":["sha256:aaaaaaaaaaaaaaaaaaaaaaaaaaaaaaaaaaaaaaaaaaaaaaaaaaaaaaaaaaaaaaaa"],"upstreamArtifactDigests":["sha256:bbbbbbbbbbbbbbbbbbbbbbbbbbbbbbbbbbbbbbbbbbbbbbbbbbbbbbbbbbbbbbbb"],"data":{"proposedPolicy":"Require independent review of the synthetic proposal.","authorityStatus":"unverified","controls":["control:independent-review"],"exceptions":[],"effectiveStatus":"not-effective"}}
